{
  "status": "PASS",
  "findings": [],
  "blocking_findings": [],
  "scientific_change_required": false,
  "kind": "independent",
  "notes": "Read-only /root/p1_r4_review: P1_R4_PASS_T11_REFINED_CONTRACT for exact proposal in design.md. Verified 15 study hashes and 24 frozen inputs, 12 amplitudes and identical final times, admissibility/conservation, all pairs and peak errors decreasing in both transitions, parent gates N800/N1600. Existing T03 limits plus convergence justified; explicitly withdraw <=8% guarantee, no equivalent-criterion claim. CFL0.1 diagnostic, finite-grid evidence only. R4 adoption/T11 first allowed, P2A not yet approved; no P2B/P3."
}
